include,title,abstract,first_author,year,journal,doi,pubmed_id,authors,pubmed_type,publication_types,mesh,webofscience_id,central_id,openalex_id,title_length,title_word_count,title_sentence_count,abstract_length,abstract_word_count,abstract_sentence_count,language_title,language_abstract
false,unchanged gene expression glycogen synthase muscle patient niddm follow sulphonylurea induced improvement glycaemic control,previously show mrna expression muscle glycogen synthase decrease non insulin dependent diabetic niddm patient objective present protocol examine whether gene expression muscle glycogen synthase niddm affect chronic sulphonylurea treatment ten obese patient niddm study week treatment weight maintaining diet combination sulphonylurea gliclazide gliclazide treatment associate significant reduction hba c p fast plasma glucose p well enhance beta cell response oral glucose load euglycaemic hyperinsulinaemic clamp mu x kg x min combination indirect calorimetry p increase whole body insulin stimulated glucose disposal rate predominantly due increase non oxidative glucose metabolism p demonstrate teh gliclazide treated patient compare pre treatment value biopsy obtain vastus lateralis muscle insulin infusion half maximal activation glycogen synthase achieve significantly low concentration allosteric activator glucose phosphate p however despite significant increase insulin stimulated non oxidative glucose metabolism muscle glycogen synthase activation gliclazide treated patient change find level glycogen synthase mrna immunoreactive protein muscle conclusion improve blood glucose control gliclazide treated obese niddm patient impact gene expression muscle glycogen synthase,Vestergaard H,1995,Diabetologia,https://doi.org/10.1007/bf00422374,8690177,Vestergaard H; Lund S; Bjørbaek C; Pedersen O,article,"D016428: Journal Article; D013485: Research Support, Non-U.S. Gov't","D000328: Adult; D000368: Aged; D000818: Animals; D001483: Base Sequence; D001706: Biopsy; D001786: Blood Glucose; D002096: C-Peptide; D017931: DNA Primers; D018076: DNA, Complementary; D003924: Diabetes Mellitus, Type 2; D005260: Female; D015870: Gene Expression; D005907: Gliclazide; D005914: Globins; D015309: Glucose Clamp Technique; D005951: Glucose Tolerance Test; D006006: Glycogen Synthase; D006801: Humans; D006946: Hyperinsulinism; D007004: Hypoglycemic Agents; D007262: Infusions, Intravenous; D007328: Insulin; D008297: Male; D008875: Middle Aged; D008969: Molecular Sequence Data; D018482: Muscle, Skeletal; D016133: Polymerase Chain Reaction; D012333: RNA, Messenger; D011817: Rabbits",,,https://openalex.org/W2050310915,146,18,1,1665,253,7,en,en
false,efficacy combination therapy insulin oral hypoglycemic agent patient type ii diabetes year period,abstract retrospective study author assess efficacy combined insulin oral hypoglycemic agent ohas control glycemic level well lipid level insulin requirement patient type diabetes mellitus year period thirty two patient secondary failure oha group sixteen patient group take high dos insulin alone overall patient respond combination therapy insulin month response define decrease hemoglobin ale month patient continue respond regimen significant difference see patient total cholesterol triglyceride level responder nonresponders group year combination oha insulin therapy patient show reduction daily insulin dose,Mozersky RP,1996,J Am Osteopath Assoc,https://doi.org/10.7556/jaoa.1996.96.6.346,8690621,Mozersky RP; Patel H; Bahl VK; Bahl S; Mook W,article,"D016430: Clinical Trial; D016428: Journal Article; D013485: Research Support, Non-U.S. Gov't","D000284: Administration, Oral; D000328: Adult; D000368: Aged; D000704: Analysis of Variance; D001786: Blood Glucose; D003924: Diabetes Mellitus, Type 2; D004359: Drug Therapy, Combination; D005260: Female; D006801: Humans; D007004: Hypoglycemic Agents; D007328: Insulin; D008055: Lipids; D008297: Male; D008875: Middle Aged; D012189: Retrospective Studies; D016896: Treatment Outcome",,,https://openalex.org/W180141447,130,20,1,939,173,8,en,en
false,effect troglitazone new hypoglycemic agent patient niddm poorly control diet therapy,objective investigate clinical efficacy troglitazone newly develop oral hypoglycemic agent patient niddm research design method niddm patient year age whose glycemic control diet judge stable judge unsatisfactory fast plasma glucose fpg mmol l enter multicenter double blind study parallel group study randomly allocate two group troglitazone group group mg day p placebo group p group treat test drug week result evaluate efficacy patient group patient p group significant difference baseline characteristic p group group fpg hba c decrease significantly treatment versus fpg vs mmol l p lt hba c v p lt fpg hba c change treatment p group versus fpg vs mmol l hba c vs patient group classify responder serum triglyceride level also decrease group p group body weight increase slightly group difference change blood pressure two group serious adverse event occur either group conclusion troglitazone mg day decrease fpg hba c significantly niddm patient fail respond diet therapy troglitazone develop drug enhance insulin action useful hypoglycemic agent treatment niddm,Iwamoto Y,1996,Diabetes Care,https://doi.org/10.2337/diacare.19.2.151,8718436,Iwamoto Y; Kosaka K; Kuzuya T; Akanuma Y; Shigeta Y; Kaneko T,article,"D016430: Clinical Trial; D003160: Comparative Study; D016428: Journal Article; D016448: Multicenter Study; D016449: Randomized Controlled Trial; D013485: Research Support, Non-U.S. Gov't","D000328: Adult; D000368: Aged; D000369: Aged, 80 and over; D001794: Blood Pressure; D001835: Body Weight; D002784: Cholesterol; D002839: Chromans; D003924: Diabetes Mellitus, Type 2; D003927: Diet, Diabetic; D004311: Double-Blind Method; D005260: Female; D006442: Glycated Hemoglobin; D006801: Humans; D007004: Hypoglycemic Agents; D008297: Male; D008875: Middle Aged; D010919: Placebos; D013844: Thiazoles; D045162: Thiazolidinediones; D014280: Triglycerides; D000077288: Troglitazone",,,https://openalex.org/W2080744024,106,17,1,1748,356,15,en,en
false,metformin noninsulin dependent diabetes mellitus,metformin oral antihyperglycemic agent approve food drug administration treatment noninsulin dependent diabetes mellitus differ sulfonylurea enhance insulin secretion normally produce hypoglycemia metformin act decrease preprandial postprandial blood glucose concentration increase skeletal muscle uptake glucose decrease gluconeogenesis decrease absorption glucose addition metformin maximum dosage sulfonylurea may synergistically improve glucose control drug may offer potential benefit weight loss minimal weight gain improve blood flow patient peripheral vascular disease reduction tissue plasminogen activator inhibitor improve lipid profile relatively safe take appropriately common side effect gastrointestinal nausea diarrhea anorexia metallic taste vitamin b malabsorption lactic acidosis may also occur rare metformin avoid patient contraindication use careful monitoring agent may consider initial treatment obese patient fail dietary measure whose disease refractory maximum dosage sulfonylurea tolerate,Lee AJ,1996,Pharmacotherapy,,8726592,Lee AJ,article,D016428: Journal Article; D016454: Review,"D001835: Body Weight; D002986: Clinical Trials as Topic; D003924: Diabetes Mellitus, Type 2; D004347: Drug Interactions; D004359: Drug Therapy, Combination; D006801: Humans; D006937: Hypercholesterolemia; D007004: Hypoglycemic Agents; D008687: Metformin",,,,52,6,1,1348,218,9,en,en
false,high carbohydrate diet different effect niddm patient treat diet alone hypoglycemic drug,compare effect nigh carbohydrate diet blood glucose plasma lipid niddm patient either mild severe glucose intolerance crossover design day intervention diet use eighteen patient separate two group basis hypoglycemic treatment diet n diet plus glibenclamide n assign day treatment high carbohydrate low fiber diet contain energy carbohydrate fat low carbohydrate low fiber diet energy carbohydrate fat cross diet days high carbohydrate diet produce significant increase postprandial blood glucose patient glibenclamide vs mmol l p difference record group diet alone vs mmol l postprandial insulin level significantly high high carbohydrate diet group diet along vs pmol l p significant difference observe group vs pmol l high carbohydrate diet also induce significant increase fast plasma triglyceride concentration group vs mmol l p vs mmol l p difference observe fast plasma cholesterol hdl effect high carbohydrate diet blood glucose control niddm patient differ accord severity glucose intolerance,Parillo M,1996,Diabetes Care,https://doi.org/10.2337/diacare.19.5.498,8732716,Parillo M; Giacco R; Ciardullo AV; Rivellese AA; Riccardi G,article,"D016430: Clinical Trial; D003160: Comparative Study; D018848: Controlled Clinical Trial; D016428: Journal Article; D013485: Research Support, Non-U.S. Gov't","D015415: Biomarkers; D001786: Blood Glucose; D018592: Cross-Over Studies; D003924: Diabetes Mellitus, Type 2; D004040: Dietary Carbohydrates; D004041: Dietary Fats; D005905: Glyburide; D006442: Glycated Hemoglobin; D006801: Humans; D007004: Hypoglycemic Agents; D008875: Middle Aged",,,https://openalex.org/W2067916345,117,18,1,1581,286,4,en,en
false,daytime glibenclamide bedtime nph insulin compare intensive insulin treatment secondary sulphonylurea failure year follow,aim study compare metabolic effect combination daytime glibenclamide even nph insulin intensive insulin treatment rapid act insulin meal nph insulin bedtime patient exhibit secondary failure sulphonylurea treatment thirty nine mildly obese niddm patient bmi randomize week intensive insulin treatment either combination treatment ct n continue intensive insulin treatment n difference two group age diabetes duration bmi hba c basal glucagon stimulate c peptide patient follow year finding analyse intent treat basis two patient ct group exclude month respectively due unacceptably high postprandial glucose value significant difference hba c ct group month n v n p month n v n initial intensive insulin treatment bmi constant ct group increase significantly month group conclude treatment associate marked long term improvement glycaemic control intensive insulin treatment lead pronounced weight increase long run might negative effect overall metabolic control therefore combination treatment together intensified education dietary advice regard initial treatment choice oral agent failure moderately obese niddm patient,Clauson P,1996,Diabet Med,https://doi.org/10.1002/(sici)1096-9136(199605)13:5<471::aid-dia103>3.0.co;2-t,8737030,Clauson P; Karlander S; Steen L; Efendic S,article,"D016430: Clinical Trial; D003160: Comparative Study; D016428: Journal Article; D016449: Randomized Controlled Trial; D013485: Research Support, Non-U.S. Gov't","D000368: Aged; D000419: Albuminuria; D000704: Analysis of Variance; D001786: Blood Glucose; D015992: Body Mass Index; D002096: C-Peptide; D002784: Cholesterol; D008076: Cholesterol, HDL; D008078: Cholesterol, LDL; D003924: Diabetes Mellitus, Type 2; D004334: Drug Administration Schedule; D005260: Female; D005905: Glyburide; D006442: Glycated Hemoglobin; D006801: Humans; D007004: Hypoglycemic Agents; D007328: Insulin; D007336: Insulin, Isophane; D061389: Insulin, Regular, Pork; D008297: Male; D008687: Metformin; D008875: Middle Aged; D013453: Sulfonylurea Compounds; D017211: Treatment Failure; D014280: Triglycerides",,,https://openalex.org/W2068668933,140,19,1,1701,325,10,en,en
true,sulphonylurea treatment niddm patient cardiovascular disease mixed blessing,non insulin dependent diabetic niddm patient show high incidence cardiovascular disease great risk recurrent myocardial infarction less favourable clinical outcome non diabetic patient majority niddm patient treat sulphonylurea su derivative university group diabetes program conclude tolbutamide treatment cause increased cardiovascular mortality study lead curtailment oral antidiabetic treatment usa receive scepticism europe later criticism methodology reduce impact study however question safety su niddm patient cardiovascular disease opened face new experimental data heart vascular tissue prerequisite su action e su receptor atp dependent k k atp channel channel play important role protection myocardium ischaemia reperfusion damage closure su could lead amplified ischaemic damage review evidence animal human study deleterious su effect ischaemia induced myocardial damage either direct action diminish cardioprotective preconditioning closure k atp channel su lead reduction post infarct arrhythmia drug also claim improve various atherosclerosis risk factor evidence beneficial effect su also review look major difficulty hamper transfer information experimental study clinical decision making affinity su heart k atp channel order magnitude low beta cell channel reasonable expect vivo cardiac effect therapeutic pancreatic su dos b study utilized high dos acutely administer su effect similar chronic steady state su treated diabetic patient c convince su effect demonstrate acutely induce ischaemia acutely administer drug effect persist clinical situation gradually progressive ischaemia ischaemia modification k atp channel activity induce complex event opposing effect net result su action different su derivative lead different outcome e chronic hence clinically relevant situation direct deleterious beneficial su effect separate beneficial effect mediate metabolic action drug large prospective clinical study make use advanced technology assessment cardiovascular function answer question million niddm patient treat su derivative many age group cardiovascular risk extremely high question whether su derivative beneficial deleterious patient must finally settle unequivocally,Leibowitz G,1996,Diabetologia,https://doi.org/10.1007/bf00403296,8739909,Leibowitz G; Cerasi E,article,D016428: Journal Article; D016454: Review,"D018528: ATP-Binding Cassette Transporters; D000818: Animals; D002318: Cardiovascular Diseases; D003924: Diabetes Mellitus, Type 2; D003925: Diabetic Angiopathies; D006801: Humans; D007004: Hypoglycemic Agents; D017202: Myocardial Ischemia; D015221: Potassium Channels; D024661: Potassium Channels, Inwardly Rectifying; D011955: Receptors, Drug; D013453: Sulfonylurea Compounds; D064233: Sulfonylurea Receptors",,,https://openalex.org/W2062947421,88,13,1,2967,490,18,en,en
false,circulate catecholamine metabolic effect captopril niddm patient,objective evaluate effect captopril circulate catecholamine level niddm patient possible relationship captopril related change circulate catecholamine level insulin sensitivity research design method fourteen nonobese normotensive niddm men age year undergo h euglycemic hyperinsulinemic clamp mu min baseline evaluation insulin sensitivity follow random assignment patient either captopril placebo treatment accord crossover double blind design euglycemic hyperinsulinemic clamp study repeat patient placebo captopril treatment plasma norepinephrine ne epinephrine e level assess clamp result result data show plasma catecholamine level increase baseline euglycemic hyperinsulinemic clamp ne time vs time min p lt e time vs time min p lt captopril treatment significantly increase total glucose uptake mmol kg min p lt reduced baseline plasma ne p lt e p lt level however magnitude ne time vs time min p lt e time vs time min p lt increment euglycemic hyperinsulinemia affect drug percentage change ratio total body glucose uptake circulate insulin level correspond decrement baseline plasma e level captopril therapy negatively correlate r p lt conclusion reduction circulate catecholamine could contribute least part captopril related amelioration insulin sensitivity,De Mattia G,1996,Diabetes Care,https://doi.org/10.2337/diacare.19.3.226,8742566,De Mattia G; Ferri C; Laurenti O; Cassone-Faldetta M; Piccoli A; Santucci A,article,D016430: Clinical Trial; D003160: Comparative Study; D016428: Journal Article; D016449: Randomized Controlled Trial,"D000328: Adult; D000806: Angiotensin-Converting Enzyme Inhibitors; D001786: Blood Glucose; D002216: Captopril; D018592: Cross-Over Studies; D003924: Diabetes Mellitus, Type 2; D004837: Epinephrine; D015309: Glucose Clamp Technique; D006801: Humans; D007262: Infusions, Intravenous; D007328: Insulin; D008297: Male; D009638: Norepinephrine",,,https://openalex.org/W2007549123,79,10,1,1848,351,10,en,en
false,comparison acarbose versus metformin adjuvant therapy sulfonylurea treated niddm patient,compare effect acarbose metformin treatment use adjunct sulfonylurea agent treatment niddm adequately control use sulfonylurea agent alone poorly control female niddm patient sulfonylurea treatment randomly select outpatient diabetic clinic study week receive either acarbose mg daily metformin mg daily addition sulfonylurea crossover design use week washout period treatment efficacy drug regimen assess measure level glycosylated hemoglobin fast h postprandial blood glucose ppbg level cholesterol triglyceride fibrinogen level week therapy metabolic parameter measure initiation either treatment regimen similar mean fasting h postprandial glucose level reduce moderately end week combination treatment p although fasting h postprandial plasma insulin c peptide fibrinogen level end week treatment period low obtain beginning study difference value statistically significant cholesterol level remain unchanged h ppbg level group use acarbose plus sulfonylurea low level achieve group use metformin plus sulfonylurea vs mmol l respectively p difference pre posttreatment level h ppbg level arm study statistically significant delta acarbose vs delta metformin p specific drug associated side effect observe patient acarbose patient metformin acarbose metformin use effective adjuvant therapy sulfonylurea agent niddm patient poorly control sulfonylurea agent alone,Bayraktar M,1996,Diabetes Care,https://doi.org/10.2337/diacare.19.3.252,8742572,Bayraktar M; Van Thiel DH; Adalar N,article,D016430: Clinical Trial; D003160: Comparative Study; D016428: Journal Article; D016449: Randomized Controlled Trial,"D020909: Acarbose; D000328: Adult; D001786: Blood Glucose; D002096: C-Peptide; D002784: Cholesterol; D003924: Diabetes Mellitus, Type 2; D004359: Drug Therapy, Combination; D006442: Glycated Hemoglobin; D006801: Humans; D007004: Hypoglycemic Agents; D007328: Insulin; D008687: Metformin; D008875: Middle Aged; D013453: Sulfonylurea Compounds; D014280: Triglycerides; D014312: Trisaccharides",,,https://openalex.org/W2027615758,103,14,1,2018,342,9,en,en
false,new traditional treatment glycemia niddm,,Bloomgarden ZT,1996,Diabetes Care,https://doi.org/10.2337/diacare.19.3.295,8742586,Bloomgarden ZT,article,D016423: Congress,"D000818: Animals; D001786: Blood Glucose; D003924: Diabetes Mellitus, Type 2; D015316: Genetic Therapy; D051275: Glucose Transporter Type 4; D006801: Humans; D007004: Hypoglycemic Agents; D051379: Mice; D008822: Mice, Transgenic; D009004: Monosaccharide Transport Proteins; D009124: Muscle Proteins; D013453: Sulfonylurea Compounds",,,https://openalex.org/W2320464786,50,8,1,0,0,0,en,
true,novel mechanism glipizide sulfonylurea action decrease metabolic clearance rate insulin,examine whether sulfonylureas inhibit metabolic clearance rate mcr insulin healthy young subject participate two experiment first protocol n h oral glucose load perform without mg glipizide give min glucose ingestion total insulin response great without glipizide vs microu ml p however total c peptide response virtually identical vs nmol l study second protocol n mcr insulin measure h euglycemic insulin clamp perform without glipizide study glipizide subject ingest mg glipizide min steady state plasma insulin concentration th h e h glipizide ingestion significantly high nd h e glipizide ingestion vs microu ml p addition glucose uptake th h great vs mg kg min mcr insulin reduce vs ml min p conclude glipizide augments plasma insulin level enhance secretion decrease mcr insulin,Barzilai N,1995,Acta Diabetol,https://doi.org/10.1007/bf00576262,8750768,Barzilai N; Groop PH; Groop L; DeFronzo RA,article,"D016428: Journal Article; D013485: Research Support, Non-U.S. Gov't; D013487: Research Support, U.S. Gov't, P.H.S.","D000328: Adult; D002096: C-Peptide; D005260: Female; D005913: Glipizide; D005947: Glucose; D015309: Glucose Clamp Technique; D006801: Humans; D007004: Hypoglycemic Agents; D007262: Infusions, Intravenous; D007328: Insulin; D007700: Kinetics; D008297: Male; D008657: Metabolic Clearance Rate",,,https://openalex.org/W2092585967,97,14,1,1288,260,9,en,en
false,effect physical exercise glycemia healthy subject follow administration glimepiride,sulfonylurea predispose hypoglycaemia exercise hypoglycaemic effect novel sulfonylurea glimepiride g ca male healthy volunteer condition subject expose three experimental situation administration mg g rest administration mg g min bicycle ergometry e work load adjust heart rate bpm placebo p bicycle ergometry mention precede follow min physical rest base line glycaemia comparable pe mg dl gr mg dl ge mg dl fell gr mg dl min ge glycaemia cease decline min exercise rise thereafter reach value comparable pe min vs mg dl serum insulin concentration rise exercise follow administration g microu ml auc period min administration ge microu ml min gr microu ml min fell pe microu ml microu ml p vs ge gr ge serum insulin concentration fell microu ml end exercise thereafter auc period min administration microu ml min whereas remain microu ml gr microu ml min p vs ge conclusion exercise blunts hypoglycaemic effect glimepiride healthy individual,Gudat U,1996,Arzneimittelforschung,,8767351,Gudat U; Heinemann L,article,D016430: Clinical Trial; D004740: English Abstract; D016428: Journal Article; D016449: Randomized Controlled Trial,D000328: Adult; D001786: Blood Glucose; D002096: C-Peptide; D015444: Exercise; D005080: Exercise Test; D005260: Female; D005934: Glucagon; D006339: Heart Rate; D006801: Humans; D007004: Hypoglycemic Agents; D007328: Insulin; D007773: Lactates; D019344: Lactic Acid; D008297: Male; D013453: Sulfonylurea Compounds,,,https://openalex.org/W2410541868,107,18,1,1509,299,9,en,en
true,effect aspirin ibuprofen pharmacokinetics pharmacodynamics glyburide healthy subject,objective determine effect aspirin ibuprofen pharmacokinetics pharmacodynamics glyburide healthy volunteer design single center randomize two way crossover design follow initial baseline evaluation phase setting outpatient university based ambulatory care facility patient sixteen healthy nonsmoking men age year intervention three phase consist six treatment phase begin treatment baseline oral glucose tolerance test gtt follow treatment b glyburide mg plus gtt two phase administer crossover design phase consist administration aspirin mg qid day day gtt administer treatment c day glyburide mg plus gtt administer treatment e phase consist administration ibuprofen mg qid day gtt day treatment glyburide mg plus gtt day treatment f main outcome measure serum glyburide concentration treatment well glucose insulin ibuprofen salicylate serum concentration glyburide free fraction result aspirin administration result increase mean total glyburide oral clearance increase glyburide free fraction ibuprofen administration result slight increase mean glyburide free fraction significant change glyburide pharmacokinetic parameter observe insulin concentration increase glyburide plus aspirin treatment conflict result observe glucose parameter conclusion potential glyburide aspirin interaction result transient hypoglycemia consider diabetic patient receive glyburide therapy,Kubacka RT,1996,Ann Pharmacother,https://doi.org/10.1177/106002809603000103,8773160,Kubacka RT; Antal EJ; Juhl RP; Welshman IR,article,"D016430: Clinical Trial; D016428: Journal Article; D016449: Randomized Controlled Trial; D013485: Research Support, Non-U.S. Gov't","D000328: Adult; D000894: Anti-Inflammatory Agents, Non-Steroidal; D001241: Aspirin; D001786: Blood Glucose; D018592: Cross-Over Studies; D004347: Drug Interactions; D005951: Glucose Tolerance Test; D005905: Glyburide; D006801: Humans; D007004: Hypoglycemic Agents; D007052: Ibuprofen; D007328: Insulin; D008297: Male",,,https://openalex.org/W2157223833,110,15,1,1796,310,16,en,en
false,american diabetes association postgraduate course treatment prevention diabetes,,Bloomgarden ZT,1996,Diabetes Care,https://doi.org/10.2337/diacare.19.7.784,8799649,Bloomgarden ZT,article,D016423: Congress,"D003920: Diabetes Mellitus; D003924: Diabetes Mellitus, Type 2; D019468: Disease Management; D004502: Education, Medical, Continuing; D006266: Health Education; D006801: Humans; D007328: Insulin; D008329: Managed Care Programs; D012955: Societies, Medical; D014481: United States",,,https://openalex.org/W2048458604,93,13,1,0,0,0,en,
