include,title,abstract,first_author,year,journal,doi,pubmed_id,authors,pubmed_type,publication_types,mesh,webofscience_id,central_id,openalex_id,title_length,title_word_count,title_sentence_count,abstract_length,abstract_word_count,abstract_sentence_count,language_title,language_abstract
false,pharmacokinetics repaglinide healthy caucasian japanese subject,objective study investigate pharmacokinetics three different single dos mg repaglinide healthy caucasian japanese subject single center open label randomize three period crossover study healthy male subject caucasian japanese receive three different single dos repaglinide mg consecutive hour interval pharmacokinetic profile include area curve auc maximum serum concentration c max time c max max half life determine dose repaglinide relative change blood glucose level rc h area blood glucose curve augc hour dose also measure oral dosing c max auc increase linearly dose within mg dose range regardless ethnic group c max auc significantly high japanese subject caucasian subject dose repaglinide c max auc statistically significantly higher japanese caucasian subject p respectively discrepancy body weight body mass index bmi caucasian japanese subject could explain group difference c max auc statistically significant difference pharmacodynamic parameter rc h augc find ethnic group p difference pronounce rc h augc dose mg mean decrease rc h japanese subject caucasian subject hypoglycemic reaction common high dose mg observe frequently japanese case caucasian subject case conclude high serum level repaglinide great reduction blood glucose level find japanese caucasian subject follow single oral dose repaglinide within mg dose range repaglinide well tolerate ethnic group result indicate glycemic control target may achieve low dos within recommended range mg meal repaglinide use treat japanese patient comparison caucasian patient,Thomsen MS,2003,J Clin Pharmacol,https://doi.org/10.1177/0091270002239702,12520624,Thomsen MS; Chassard D; Evène E; Nielsen KK; Jørgensen M,article,"D016430: Clinical Trial; D003160: Comparative Study; D016428: Journal Article; D016449: Randomized Controlled Trial; D013485: Research Support, Non-U.S. Gov't","D000293: Adolescent; D000328: Adult; D044466: Asian People; D002219: Carbamates; D018592: Cross-Over Studies; D004305: Dose-Response Relationship, Drug; D006801: Humans; D007004: Hypoglycemic Agents; D008297: Male; D008875: Middle Aged; D010880: Piperidines; D044465: White People",,,https://openalex.org/W1994456278,74,9,1,2326,439,14,en,en
false,tolbutamide flurbiprofen losartan probe cyp c activity human,metabolic activity cyp c subject express four different genotype cyp c evaluate single oral dos tolbutamide flurbiprofen losartan administer randomized crossover design plasma urine collect hour urinary metabolic ratio amount metabolite excrete correlate formation clearance formation clearance tolbutamide cyp c mediated metabolite demonstrate strong association genotype compare flurbiprofen losartan respectively r vs vs statistically significant correlation observe formation clearance tolbutamide hour urinary amount hydroxytolbutamide carboxytolbutamide r compare tolbutamide correlation observe respective measure flurbiprofen losartan metabolism strong tolbutamide good cyp c probe flurbiprofen losartan hour amount hydroxytolbutamide carboxytolbutamide best urinary measure metabolism,Lee CR,2003,J Clin Pharmacol,https://doi.org/10.1177/0091270002239710,12520632,Lee CR; Pieper JA; Frye RF; Hinderliter AL; Blaisdell JA; Goldstein JA,article,"D016430: Clinical Trial; D003160: Comparative Study; D016428: Journal Article; D016449: Randomized Controlled Trial; D013487: Research Support, U.S. Gov't, P.H.S.",D000328: Adult; D001189: Aryl Hydrocarbon Hydroxylases; D018592: Cross-Over Studies; D065729: Cytochrome P-450 CYP2C9; D005260: Female; D005480: Flurbiprofen; D005838: Genotype; D006801: Humans; D019808: Losartan; D008297: Male; D010641: Phenotype; D014044: Tolbutamide,,,https://openalex.org/W1974766025,78,13,1,1162,200,8,en,en
false,angiotensin receptor blocker antihypertensive cardiovascular round medication year,angiotensin receptor blocker part antihypertensive treatment armamentarium since mid period number agent increase greatly number indication drug test randomize controlled clinical trial begin efficacious well tolerated antihypertensive angiotensin receptor blocker show benefit patient diabetes heart failure attributable reduce blood pressure support recently conclude trial expand treatment area agent widen interest applicability across entire cardiovascular continuum number large scale study set report within next year far determine effect angiotensin receptor blocker range cardiovascular indication beyond hypertension,Maggioni AP,2002,Blood Press,https://doi.org/10.1080/080370502321095285,12523675,Maggioni AP; Latini R,article,D016428: Journal Article; D016454: Review,"D057911: Angiotensin Receptor Antagonists; D000806: Angiotensin-Converting Enzyme Inhibitors; D000818: Animals; D000959: Antihypertensive Agents; D002317: Cardiovascular Agents; D002318: Cardiovascular Diseases; D003924: Diabetes Mellitus, Type 2; D006333: Heart Failure; D006801: Humans; D009203: Myocardial Infarction; D012084: Renin-Angiotensin System",,,https://openalex.org/W2086389738,110,14,1,907,136,5,en,en
false,molecular basis kir channel inhibition adenine nucleotide,k atp channel comprise pore forming protein kir x sulfonylurea receptor surx interaction adenine nucleotide kir positively charge amino acid k r c terminus cause channel closure substitution amino acid positively charge residue small effect inhibition adenine nucleotide substitution neutral negative residue major effect suggest electrostatic interaction kir positive charge adenine nucleotide negative phosphate group furthermore r mutation decrease channel sensitivity atp adp amp similar extent k mutation decrease primarily atp adp sensitivity leave amp sensitivity relatively unaffected thus channel inhibition atp may involve interaction alpha phosphate r interaction beta phosphate k addition decrease open probability due rundown sulfonylureas cause increase atp sensitivity k mutant r mutant thus beta phosphate may bind state independent fashion k destabilize channel opening r interacts alpha phosphate stabilize channel close configuration substitution r c terminus r n terminus different charge residue also affect atp sensitivity base result structural scheme propose include feature recently publish model,Ribalet B,2003,Biophys J,https://doi.org/10.1016/s0006-3495(03)74847-4,12524280,Ribalet B; John SA; Weiss JN,article,"D016428: Journal Article; D013485: Research Support, Non-U.S. Gov't; D013487: Research Support, U.S. Gov't, P.H.S.","D000227: Adenine Nucleotides; D000255: Adenosine Triphosphate; D000596: Amino Acids; D004305: Dose-Response Relationship, Drug; D005905: Glyburide; D006801: Humans; D015640: Ion Channel Gating; D007668: Kidney; D024661: Potassium Channels, Inwardly Rectifying; D011994: Recombinant Proteins; D012680: Sensitivity and Specificity; D014162: Transfection",,,https://openalex.org/W1985451719,68,9,1,1513,243,9,en,en
false,influence treatment acarbose glibenclamide insulin sensitivity type diabetic patient,aim double blind placebo controlled study compare effect acarbose glibenclamide insulin sensitivity type diabetes investigate patient mean age year mean bmi kg treat diet alone least week subject randomize three treatment group week mg acarbose n mg glibenclamide n one placebo n therapy level fast plasma glucose glycosylated haemoglobin fast insulin plasma glucose insulin h standardized breakfast measure insulin sensitivity determine euglycaemic hyperinsulinaemic clamp test treatment period bmi acarbose placebo group decrease significantly whereas glibenclamide group significant increase observe fast plasma glucose significant reduce glibenclamide postprandial glucose decrease significantly acarbose vs mmol l p glibenclamide treatment vs mmol l p unchanged placebo vs mmol l fasting insulin level remain unchanged three group whereas postprandial insulin value increase significantly glibenclamide neither acarbose glibenclamide significantly change insulin sensitivity acarbose glucose disposal rate treatment mg kg body weight min insulin treatment glibenclamide vs placebo vs result show substantial improvement glucose control glibenclamide acarbose however associate increase insulin sensitivity,Fischer S,2003,Diabetes Obes Metab,https://doi.org/10.1046/j.1463-1326.2003.00239.x,12542723,Fischer S; Patzak A; Rietzsch H; Schwanebeck U; Köhler C; Wildbrett J; Fuecker K; Temelkova-Kurktschiev T; Hanefeld M,article,D016430: Clinical Trial; D003160: Comparative Study; D016428: Journal Article; D016449: Randomized Controlled Trial,"D020909: Acarbose; D000328: Adult; D000368: Aged; D001786: Blood Glucose; D015992: Body Mass Index; D001835: Body Weight; D003924: Diabetes Mellitus, Type 2; D004311: Double-Blind Method; D005260: Female; D005500: Follow-Up Studies; D015309: Glucose Clamp Technique; D005905: Glyburide; D006801: Humans; D007004: Hypoglycemic Agents; D007333: Insulin Resistance; D008055: Lipids; D008297: Male; D008875: Middle Aged",,,https://openalex.org/W1930639259,104,15,1,1718,294,10,en,en
false,plasma adiponectin play important role improve insulin resistance glimepiride elderly type diabetic subject,investigate effect glimepiride third generation sulfonylurea hypoglycemic agent insulin resistance elderly patient type diabetes connection plasma adiponectin epi prostagrandin f alpha epi pgf alpha oxidative stress marker total elderly patient type diabetes receive week treatment glimepiride homeostasis assessment model insulin resistance homa ir homeostasis assessment model beta cell function hba c c peptide h pooled urine urine cpr plasma concentration epi pgf alpha tumor necrosis factor alpha tnf alpha plasminogen activator inhibitor type adiponectin measure various time metabolic clearance rate glucose mcr g also assess hyperinsulinemic euglycemic clamp week glimepiride treatment significant reduction observe hba c homa ir plasma tnf alpha concentration pg ml mcr g significantly increase mg kg min plasma adiponectin increase micro g ml control subject maintain conventional treatment significant change observe markers glimepiride remarkably improve insulin resistance suggest significant reduction homa ir increase mcr g reduction hba c without change extrapancreatic beta cell function urine cpr increase plasma adiponectin decreased plasma tnf alpha may underlie improvement insulin resistance glimepiride,Tsunekawa T,2003,Diabetes Care,https://doi.org/10.2337/diacare.26.2.285,12547850,Tsunekawa T; Hayashi T; Suzuki Y; Matsui-Hirai H; Kano H; Fukatsu A; Nomura N; Miyazaki A; Iguchi A,article,"D016430: Clinical Trial; D016428: Journal Article; D016449: Randomized Controlled Trial; D013485: Research Support, Non-U.S. Gov't","D052242: Adiponectin; D000368: Aged; D003924: Diabetes Mellitus, Type 2; D015237: Dinoprost; D005260: Female; D006801: Humans; D007004: Hypoglycemic Agents; D007333: Insulin Resistance; D036341: Intercellular Signaling Peptides and Proteins; D008297: Male; D008875: Middle Aged; D009994: Osmolar Concentration; D017395: Plasminogen Activator Inhibitor 1; D011506: Proteins; D013453: Sulfonylurea Compounds; D014409: Tumor Necrosis Factor-alpha",,,https://openalex.org/W2159693162,127,18,1,1706,296,8,en,en
true,pharmacotherapy diabetes mellitus implication prevention treatment cardiovascular disease,diabetes mellitus adult associate increase risk premature vascular disease high mortality rate presence risk factor often see diabetic patient systemic hypertension augment rate vascular disease evidence grow tight control hyperglycemia use insulin oral hypoglycemic agent modify risk aggressive control concomitant hypertension hyperlipidemia also require diabetic patient myocardial infarction bad nondiabetic patient various strategy improve outcome include use tight blood glucose control various coronary intervention currently clinical study,Ragucci E,2003,Heart Dis,https://doi.org/10.1097/01.hdx.0000050411.62103.f5,12549986,Ragucci E; Zonszein J; Frishman WH,article,D016428: Journal Article; D016454: Review,"D002318: Cardiovascular Diseases; D003924: Diabetes Mellitus, Type 2; D003925: Diabetic Angiopathies; D004359: Drug Therapy, Combination; D006801: Humans; D006949: Hyperlipidemias; D006973: Hypertension; D007004: Hypoglycemic Agents; D007328: Insulin; D009203: Myocardial Infarction; D012307: Risk Factors; D019851: Thrombophilia",,,https://openalex.org/W2032007955,109,14,1,724,112,6,en,en
false,multifactorial intervention cardiovascular disease patient type diabetes,cardiovascular morbidity major burden patient type diabetes steno study compare effect targeted intensified multifactorial intervention conventional treatment modifiable risk factor cardiovascular disease patient type diabetes microalbuminuria primary end point open parallel trial composite death cardiovascular cause nonfatal myocardial infarction nonfatal stroke revascularization amputation eighty patient randomly assign receive conventional treatment accordance national guideline receive intensive treatment stepwise implementation behavior modification pharmacologic therapy target hyperglycemia hypertension dyslipidemia microalbuminuria along secondary prevention cardiovascular disease aspirin mean age patient year mean follow year decline glycosylated hemoglobin value systolic diastolic blood pressure serum cholesterol triglyceride level measure overnight fast urinary albumin excretion rate significantly great intensive therapy group conventional therapy group patient receive intensive therapy also significantly low risk cardiovascular disease hazard ratio percent confidence interval nephropathy hazard ratio percent confidence interval retinopathy hazard ratio percent confidence interval autonomic neuropathy hazard ratio percent confidence interval target driven long term intensified intervention aim multiple risk factor patient type diabetes microalbuminuria reduce risk cardiovascular microvascular event percent,Gaede P,2003,N Engl J Med,https://doi.org/10.1056/nejmoa021778,12556541,Gaede P; Vedel P; Larsen N; Jensen GV; Parving HH; Pedersen O,article,"D016430: Clinical Trial; D003160: Comparative Study; D016428: Journal Article; D016449: Randomized Controlled Trial; D013485: Research Support, Non-U.S. Gov't","D000671: Amputation, Surgical; D000804: Angiotensin II; D000806: Angiotensin-Converting Enzyme Inhibitors; D000959: Antihypertensive Agents; D002318: Cardiovascular Diseases; D003131: Combined Modality Therapy; D003920: Diabetes Mellitus; D003924: Diabetes Mellitus, Type 2; D018752: Diet, Fat-Restricted; D015444: Exercise; D005260: Female; D006801: Humans; D006949: Hyperlipidemias; D006973: Hypertension; D007004: Hypoglycemic Agents; D000960: Hypolipidemic Agents; D008297: Male; D008875: Middle Aged; D009203: Myocardial Infarction; D009765: Obesity; D012307: Risk Factors; D016540: Smoking Cessation; D020521: Stroke; D014815: Vitamins",,,https://openalex.org/W2139634859,87,11,1,1912,305,5,en,en
false,treatment diabetes mellitus old people oral therapy option,journal american geriatrics societyvolume issue p treatment diabetes mellitus old people oral therapy option jill crandall md jill crandall md albert einstein college medicine division endocrinology geriatrics bronx new york search paper authornir barzilai md nir barzilai md albert einstein college medicine division endocrinology geriatrics bronx new york search paper author jill crandall md jill crandall md albert einstein college medicine division endocrinology geriatrics bronx new york search paper authornir barzilai md nir barzilai md albert einstein college medicine division endocrinology geriatrics bronx new york search paper author first publish january http doi org j xcitations address correspondence dr jill crandall albert einstein college medicine division endocrinology geriatrics blondell avenue suite bronx ny e mail crandall aecom yu edu read full textaboutpdf toolsrequest permissionexport citationadd favoritestrack citation shareshare give accessshare full text accessshare full text accessplease review term condition use check box share full text version article read accept wiley online library term condition useshareable linkuse link share full text version article friend colleague learn copy url share linkshare onfacebooktwitterlinkedinredditwechat cite literature volume issue february pages relatedinformation,Crandall J,2003,J Am Geriatr Soc,https://doi.org/10.1046/j.1532-5415.2003.51070.x,12558728,Crandall J; Barzilai N,article,D016428: Journal Article,"D000284: Administration, Oral; D000368: Aged; D003924: Diabetes Mellitus, Type 2; D006801: Humans; D007004: Hypoglycemic Agents",,,https://openalex.org/W1966964603,68,11,1,1719,265,3,en,en
false,rosiglitazone reduces urinary albumin excretion type ii diabetes,study examine effect rosiglitazone urinary albumin excretion uae patient type ii diabetes urinary albumin creatinine ratio acr measure week open label cardiac safety study compare rosiglitazone glyburide patient randomise treatment rosiglitazone mg b glyburide acr measure baseline week treatment statistically significant reduction baseline acr observe treatment group week week rosiglitazone group show significant reduction baseline similar result observe overall study population subset patient baseline microalbuminuria patient microalbuminuria baseline reduction acr correlate strongly reduction glycosylated haemoglobin fast plasma glucose show strong correlation change mean h systolic diastolic blood pressure rosiglitazone treated patient deltaacr v deltamean h systolic blood pressure r deltaacr vs deltamean h diastolic blood pressure r p correlation observe glyburide treated patient conclusion rosiglitazone treatment associate decrease urinary albumin excretion finding suggest potential beneficial effect rosiglitazone treatment prevention renal vascular complication type ii diabetes,Bakris G,2003,J Hum Hypertens,https://doi.org/10.1038/sj.jhh.1001444,12571611,Bakris G; Viberti G; Weston WM; Heise M; Porter LE; Freed MI,article,D016430: Clinical Trial; D003160: Comparative Study; D016428: Journal Article; D016448: Multicenter Study; D016449: Randomized Controlled Trial,"D000284: Administration, Oral; D000368: Aged; D000419: Albuminuria; D003924: Diabetes Mellitus, Type 2; D003925: Diabetic Angiopathies; D003928: Diabetic Nephropathies; D004305: Dose-Response Relationship, Drug; D004334: Drug Administration Schedule; D005260: Female; D005500: Follow-Up Studies; D006801: Humans; D007004: Hypoglycemic Agents; D007677: Kidney Function Tests; D008297: Male; D008875: Middle Aged; D012016: Reference Values; D000077154: Rosiglitazone; D012680: Sensitivity and Specificity; D013844: Thiazoles; D045162: Thiazolidinediones; D016896: Treatment Outcome",,,https://openalex.org/W2007437966,67,9,1,1491,242,12,en,en
false,population pkpd modelling long term hypoglycaemic effect gliclazide give day modify release mr formulation,aim study relationship pharmacokinetics pk gliclazide long term pharmacodynamic pd effect large population type diabetic patient identify factor predict intersubject variability method pkpd database type diabetic patient total fast plasma glucose fpg sample build data collect clinical development modified release formulation gliclazide gliclazide mr pkpd analysis use nonlinear mixed effect model approach mixture model use identify patient fpg response treatment patient identify responder decrease fpg relate gliclazide exposure auc e max relationship effect compartment use describe link pk pd linear disease progression model use assess glycaemic deterioration observable several month treatment simulation perform evaluate predictive performance pkpd model illustrate time course antidiabetic effect gliclazide mr result disease state find main explanatory factor intersubject variability response gliclazide percentage responder gliclazide use monotherapy increase inversely number class antidiabetic agent receive prior entry study responder initial dose mg gliclazide mr dose regimen induce half maximum hypoglycaemic effect equilibration half life pk pd steady state week intersubject variability rate disease progression mmol l year intersubject variability pkpd model adequately predict fpg profile patient receive current formulation gliclazide simulation year parallel dose range clinical trial illustrate influence dose time type previous antidiabetic treatment percentage patient clinically significant improvement blood glucose control conclusion population pkpd analysis characterize relationship exposure gliclazide long term hypoglycaemic effect establish intersubject variability response mostly relate disease state result underline clinical interest quickly increase dose gliclazide mr accord response treatment order achieve effective blood glucose control,Frey N,2003,Br J Clin Pharmacol,https://doi.org/10.1046/j.1365-2125.2003.01751.x,12580986,Frey N; Laveille C; Paraire M; Francillard M; Holford NH; Jochemsen R,article,"D016430: Clinical Trial; D017427: Clinical Trial, Phase II; D017428: Clinical Trial, Phase III; D016428: Journal Article","D001786: Blood Glucose; D003924: Diabetes Mellitus, Type 2; D018450: Disease Progression; D004305: Dose-Response Relationship, Drug; D005260: Female; D005907: Gliclazide; D006801: Humans; D007004: Hypoglycemic Agents; D008297: Male; D008875: Middle Aged; D008954: Models, Biological",,,https://openalex.org/W1492642476,133,20,1,2542,423,17,en,en
false,beneficial effect glyburide metformin combination preparation type diabetes mellitus,type diabetes mellitus characterize insulin deficiency insulin resistance effective treatment often require therapy direct abnormality patient monotherapy might benefit combination agent glyburide metformin increase insulin secretion reduces insulin resistance patient take glyburide metformin preparation carl hayden vamc identify pharmacy record patient documented hemoglobin value within week prior week initiation therapy subject examined glyburide metformin combination therapy reduce hemoglobin level p significant reduction see patient initial level high p significant reduction see patient initial level low patient monotherapy dual oral therapy inadequate control change glyburide metformin combination preparation may improve glucose control,Bokhari SU,2003,Am J Med Sci,https://doi.org/10.1097/00000441-200302000-00003,12589230,Bokhari SU; Gopal UM; Duckworth WC,article,"D016430: Clinical Trial; D016428: Journal Article; D016449: Randomized Controlled Trial; D013485: Research Support, Non-U.S. Gov't; D013486: Research Support, U.S. Gov't, Non-P.H.S.","D001786: Blood Glucose; D003924: Diabetes Mellitus, Type 2; D004338: Drug Combinations; D005905: Glyburide; D006441: Hemoglobin A; D006801: Humans; D007004: Hypoglycemic Agents; D007328: Insulin; D007333: Insulin Resistance; D008687: Metformin",,,https://openalex.org/W2082917156,95,12,1,1063,164,6,en,en
true,treatment type diabetes inadequate assessment oral antidiabetic combination,metformin glibenclamide oral antidiabetic proven impact complication type diabetes treatment one drug often fail achieve recommended target hba c level one randomise trial assess preventive efficacy combination oral antidiabetic hyperglycaemia persist despite treatment glucose lowering sulphonylurea trial show combine metformin glucose lowering sulphonylurea associate high mortality therapy sulphonylurea alone despite result clinical guideline recommend metformin glucose lowering sulphonylurea combination oral antidiabetic monotherapy fails absence convince data support particular strategy option discuss patient include continue oral antidiabetic monotherapy start insulin,,2003,Prescrire Int,,12602406,,article,D016428: Journal Article,"D002986: Clinical Trials as Topic; D003924: Diabetes Mellitus, Type 2; D004359: Drug Therapy, Combination; D005905: Glyburide; D006442: Glycated Hemoglobin; D006801: Humans; D007004: Hypoglycemic Agents; D007328: Insulin; D008687: Metformin; D016032: Randomized Controlled Trials as Topic",,,https://openalex.org/W4300281121,86,13,1,945,154,6,en,en
false,use octreotide treat prolonged sulfonylurea induced hypoglycemia patient chronic renal failure,diabetic patient chronic renal failure develop recurrent prolong episode hypoglycemia associate use sulfonylurea agent present patient hospitalize neuroglycopenic symptom hypoglycemia persist spite large dos parenteral glucose replacement administration somatostatin analogue octreotide hypoglycemia resolve blood glucose level maintain even cessation parenteral glucose patient receive subcutaneous dos octreotide hour apart make complete recovery experience suggest use octerotide treat refractory prolong sulfonylurea included hypoglycemia renal failure patient safe effective large prospective study would need validate finding,Nzerue CM,2003,Int J Artif Organs,https://doi.org/10.1177/039139880302600113,12602474,Nzerue CM; Thomas J; Volcy J; Edeki T,article,D002363: Case Reports; D016428: Journal Article,"D000328: Adult; D002096: C-Peptide; D003924: Diabetes Mellitus, Type 2; D005765: Gastrointestinal Agents; D005913: Glipizide; D006801: Humans; D007003: Hypoglycemia; D007004: Hypoglycemic Agents; D007676: Kidney Failure, Chronic; D008297: Male; D015282: Octreotide; D012640: Seizures",,,https://openalex.org/W2414394732,110,15,1,818,121,5,en,en
