include,title,abstract,first_author,year,journal,doi,pubmed_id,authors,pubmed_type,publication_types,mesh,webofscience_id,central_id,openalex_id,title_length,title_word_count,title_sentence_count,abstract_length,abstract_word_count,abstract_sentence_count,language_title,language_abstract
false,blood pressure rise onset microalbuminuria child follow diagnosis type diabetes,objective examine whether rise blood pressure could detect onset microalbuminuria cohort child follow diagnosis type diabetes research design methods oxford regional prospective study incident cohort study child type diabetes age mean sd year diagnosis subject assess annually diagnosis measurement hba c arterial blood pressure random zero three urine sample estimation albumin creatinine ratio follow child develop one annual assessment designate case nested case control study case match sex age diagnosis two normoalbuminuric control subject blood pressure bp data compare correspond year diabetes duration results cases similar normoalbuminuric control subject respect age bmi high mean hba c level mean difference p lt year onset diastolic bp standard deviation score sd significantly high zero case mean p lt control subject p lt difference could detect case control subject onset either systolic diastolic bp mean difference systolic mmhg ci mean difference diastolic mmhg however within case onset associate elevation systolic diastolic bp sdss f p lt f p lt bmi hba c associate systolic diastolic bp sdss subject f p f p however association bp remain significant systolic bp p diastolic bp p lt adjust bmi conclusions rise systemic bp detect first appearance child type diabetes bp rise concurrently onset also closely relate bmi,Schultz CJ,2001,Diabetes Care,https://doi.org/10.2337/diacare.24.3.555,11289484,Schultz CJ; Neil HA; Dalton RN; Konopelska Bahu T; Dunger DB; Oxford Regional Prospective Study Group,article,"D016428: Journal Article; D016448: Multicenter Study; D013485: Research Support, Non-U.S. Gov't","D000419: Albuminuria; D015415: Biomarkers; D001794: Blood Pressure; D015992: Body Mass Index; D002648: Child; D015331: Cohort Studies; D003404: Creatinine; D003922: Diabetes Mellitus, Type 1; D003971: Diastole; D005260: Female; D005500: Follow-Up Studies; D006442: Glycated Hemoglobin; D006801: Humans; D006973: Hypertension; D008297: Male; D012016: Reference Values; D013599: Systole; D013997: Time Factors",,,https://openalex.org/W2052652736,120,19,1,2153,450,14,en,en
false,lipid lipoprotein response oral combine hormone replacement therapy normolipemic obese woman controlled type diabetes mellitus,study investigate effect oral combine hormone replacement therapy ochrt lipid concentration subpopulation distribution lipoprotein nine postmenopausal woman type diabetes mellitus moderate glycemic control week continuous daily therapy conjugated estrogen mg medroxyprogesterone mg mean concentration high density lipoprotein hdl cholesterol show statistically significant increase predominantly hdl subfraction statistically significant change mean concentration total cholesterol low density lipoprotein ldl cholesterol triglyceride low density lipoprotein vldl triglyceride apolipoprotein apolipoprotein b evident likewise change find average diameter vldl ldl hdl particle triglyceride concentration vldl subfractions cholesterol concentration ldl subfractions chemical composition plasma ldl finding lend support use ochrt postmenopausal woman diabetes decrease risk coronary artery disease,Lilley SH,1998,J Clin Pharmacol,https://doi.org/10.1177/009127009803801204,11301562,Lilley SH; Spivey JM; Vadlamudi S; Otvos J; Cummings DM; Barakat H,article,"D016428: Journal Article; D013485: Research Support, Non-U.S. Gov't; D013487: Research Support, U.S. Gov't, P.H.S.","D000284: Administration, Oral; D000368: Aged; D003924: Diabetes Mellitus, Type 2; D015914: Estrogen Replacement Therapy; D005260: Female; D006442: Glycated Hemoglobin; D006801: Humans; D008055: Lipids; D008074: Lipoproteins; D008875: Middle Aged; D009765: Obesity; D010316: Particle Size",,,https://openalex.org/W2130703044,145,20,1,1135,178,5,en,en
true,hemodynamic metabolic hormonal response oral glibenclamide patient cirrhosis receive glucose,patient cirrhosis glucose may induce splanchnic renal vasodilation since antidiabetic sulfonylurea glibenclamide know induce splanchnic renal vasoconstriction portal hypertensive animal drug may inhibit glucose induced hemodynamic response patient cirrhosis aim present study investigate patient cirrhosis short term effect glibenclamide hemodynamic humoral response glucose patients randomly assign receive either glibenclamide mg tablet placebo patient receive infusion glucose ml h h start time glibenclamide placebo administration study perform prior min glibenclamide placebo glibenclamide e glibenclamide plus glucose significantly increase plasma insulin concentration glycemia placebo e glucose alone significantly increase glycemia change plasma insulin level glibenclamide significantly change hepatic venous pressure gradient value significantly increase follow glucose alone glibenclamide significantly change renal blood flow glomerular filtration rate glucose alone significantly increase renal blood flow without affect glomerular filtration rate glibenclamide significantly decrease cardiac index glucose alone change value patient cirrhosis receive glucose glibenclamide blunt glucose induced splanchnic renal vasodilation addition glibenclamide per se induce decrease cardiac index finding take account glibenclamide administer patient cirrhosis type diabetes,Moreau R,2001,Scand J Gastroenterol,https://doi.org/10.1080/003655201750074654,11305519,Moreau R; Chagneau C; Heller J; Chevenne D; Langlet P; Deltenre P; Hillaire S; Lefilliatre P; Pateron D; Sogni P; Valla D; Lebrec D,article,"D016430: Clinical Trial; D016428: Journal Article; D016449: Randomized Controlled Trial; D013485: Research Support, Non-U.S. Gov't","D000284: Administration, Oral; D005260: Female; D005947: Glucose; D005905: Glyburide; D006439: Hemodynamics; D006801: Humans; D007004: Hypoglycemic Agents; D007262: Infusions, Intravenous; D007328: Insulin; D008099: Liver; D008103: Liver Cirrhosis; D008111: Liver Function Tests; D008297: Male; D008875: Middle Aged; D011336: Probability; D012016: Reference Values; D012129: Respiratory Function Tests; D016896: Treatment Outcome",,,https://openalex.org/W2106707298,112,15,1,1779,266,12,en,en
false,sulfonylurea treatment type diabetic patient reduce vasodilator response ischemia,sulfonylurea block activation vascular potassium dependent atp channel impair vasodilating response ischcmia nondiabetic individual know whether occur type diabetic patient chronic treatment drug glimepiride new sulfonylurea apparently cardiovascular interaction aim study compare effect widely use compound glibenclamide pancreas specific glimepiride diet treatment alone brachial artery response acute forearm ischemia brachial artery examination perform high resolution ultrasound technique type diabetic patient age mean sd year nondiabetic patient match age hypertension dislipidemia diabetic subject underwent three separate evaluation end week treatment period receive glibenclamide glimepiride diet alone accord crossover design scan obtain min forearm ischemia postischemic vasodilation hyperemia express percent variation vessel diameter blood flow postischemic vasodilation hyperemia respectively glibenclamide glimepiride diet treatment ns result similar find nondiabetic patient n type diabetic patient vasodilating response forearm ischemia whether patient treat diet treatment alone glibenclamide glimepiride blood glucose lowering equipotent close,Spallarossa P,2001,Diabetes Care,https://doi.org/10.2337/diacare.24.4.738,11315840,Spallarossa P; Schiavo M; Rossettin P; Cordone S; Olivotti L; Cordera R; Brunelli C,article,"D016430: Clinical Trial; D003160: Comparative Study; D016428: Journal Article; D016449: Randomized Controlled Trial; D013485: Research Support, Non-U.S. Gov't","D000368: Aged; D000369: Aged, 80 and over; D001794: Blood Pressure; D001916: Brachial Artery; D003924: Diabetes Mellitus, Type 2; D003927: Diet, Diabetic; D005260: Female; D005542: Forearm; D005907: Gliclazide; D005905: Glyburide; D006801: Humans; D006949: Hyperlipidemias; D006973: Hypertension; D007004: Hypoglycemic Agents; D007511: Ischemia; D008297: Male; D008687: Metformin; D008875: Middle Aged; D012016: Reference Values; D012039: Regional Blood Flow; D013453: Sulfonylurea Compounds; D014463: Ultrasonography",,,https://openalex.org/W2095567616,103,15,1,1709,283,7,en,en
true,combination therapy insulin type diabetes,u k prospective diabetes study ukpds demonstrate intensive glucose control insulin sulfonylurea markedly reduce risk microvascular complication myocardial infarction reduction risk decrease hba c borderline significance correspond closely epidemiological prediction decrease drop hba c data demonstrate neither insulin sulfonylurea despite cause hyperinsulinemia weight gain adverse effect cardiovascular outcome glycemic control deteriorate continuously however even intensively treated patient ukpds ukpds worsening glycemic control attribute natural course type diabetes lack efficacy current antihyperglycemic therapy insulin therapy consist single injection ultralente isophane insulin daily dose exceed u regular insulin add home glucose monitoring encourage combination therapy regimens insulin oral agent use know u long acting insulin insufficient control fast glycemia type diabetic patient since ukpds start several study try define optimal insulin treatment regimen type diabetic patient study focus review include study compare insulin alone combination therapy insulin sulfonylurea subject meta analyses recent trial use metformin glitazones acarbose insulin combination therapy regimen contain data cardiovascular end point surrogate marker risk micro macrovascular complication mostly data glycemia body weight insulin dos lipid study also accurate data frequency hypoglycemia accord medline search,Yki-Järvinen H,2001,Diabetes Care,https://doi.org/10.2337/diacare.24.4.758,11315844,Yki-Järvinen H,article,D016428: Journal Article; D016454: Review,"D001786: Blood Glucose; D003924: Diabetes Mellitus, Type 2; D004359: Drug Therapy, Combination; D006801: Humans; D007003: Hypoglycemia; D007004: Hypoglycemic Agents; D007328: Insulin; D008055: Lipids; D016239: MEDLINE; D015430: Weight Gain",,,https://openalex.org/W2148717983,53,8,1,1991,355,14,en,en
false,postprandial blood glucose,,American Diabetes Association,2001,Diabetes Care,https://doi.org/10.2337/diacare.24.4.775,11315848,American Diabetes Association,article,"D016446: Consensus Development Conference; D016428: Journal Article; D013485: Research Support, Non-U.S. Gov't; D016454: Review",D001786: Blood Glucose; D003920: Diabetes Mellitus; D005215: Fasting; D006442: Glycated Hemoglobin; D006801: Humans; D006943: Hyperglycemia; D019518: Postprandial Period,,,https://openalex.org/W4213149640,26,3,1,0,0,0,en,
false,clinical review glimepiride,article review pharmacological clinical aspect glimepiride late second generation sulfonylurea treatment type diabetes mellitus dm glimepiride therapy ameliorate relative insulin secretory deficit find patient type dm direct insulin secretagogue indirectly also increase insulin secretion response fuel glucose action augment insulin secretion require bind high affinity sulfonylurea receptor result closure atp sensitive potassium channel beta cells pancreas question raise whether insulin secretagogues act vascular myocardial potassium channel may prevent ischaemic preconditioning physiological adaptation could affect outcome coronary heart disease evidence concern applicable glimepiride glimepiride antihyperglycaemic efficacy equal secretagogues pharmacokinetic property make less prone cause hypoglycaemia renal dysfunction insulin secretagogues particularly glyburide also know glibenclamide europe convenient daily dosing may enhance compliance diabetic patient often also require medication co morbid condition hypertension hyperlipidaemia cardiac disease glimepiride approve monotherapy combination metformin insulin clinically reduce risk hypoglycaemia make preferable insulin secretagogues attempt achieve recommended glycaemic control haemoglobin c hgba c use suppertime neutral protamine hagedorn nph regular insulin morning glimepiride overweight diabetic patient achieve glycaemic goal quickly insulin alone low insulin dos,McCall AL,2001,Expert Opin Pharmacother,https://doi.org/10.1517/14656566.2.4.699,11336617,McCall AL,article,"D016428: Journal Article; D013485: Research Support, Non-U.S. Gov't; D013487: Research Support, U.S. Gov't, P.H.S.; D016454: Review","D002986: Clinical Trials as Topic; D003924: Diabetes Mellitus, Type 2; D004347: Drug Interactions; D006801: Humans; D007004: Hypoglycemic Agents; D013453: Sulfonylurea Compounds",,,https://openalex.org/W2099466477,30,4,1,1890,297,11,en,en
false,hour glycemic profile type diabetic patient treat gliclazide modify release daily,type diabetes primary secondary prevention long term micro macrovascular complication require control blood glucose level hour day present study undertake assess effect new formulation gliclazide administer daily gliclazide modify release plasma glucose level hours type diabetic patient previously treat diet alone oral antidiabetic agent glycemic profile pm pm pm pm overall glycemic control acceptability compliance treatment assess week treatment gliclazide modify release mg give daily breakfast result indicate significant decrease plasma glucose level point cycle mean plasma glucose level hour mean plasma glucose level fasting postprandial period significantly improve treatment previous drug naive patient decrease hba c observe p acceptability good hypoglycemic event high compliance treatment also observed therefore conclude gliclazide modify release give daily breakfast effective hour reduce plasma glucose level type diabetes daily administration lead optimal patient compliance treatment,Guillausseau PJ,2001,Diabetes Metab,,11353879,Guillausseau PJ; Greb W,article,D016430: Clinical Trial; D016428: Journal Article,"D000328: Adult; D000368: Aged; D001786: Blood Glucose; D015992: Body Mass Index; D002940: Circadian Rhythm; D003692: Delayed-Action Preparations; D003924: Diabetes Mellitus, Type 2; D004334: Drug Administration Schedule; D005260: Female; D005907: Gliclazide; D006801: Humans; D007004: Hypoglycemic Agents; D008297: Male; D008875: Middle Aged; D010349: Patient Compliance; D012107: Research Design",,,https://openalex.org/W1586183545,105,16,1,1446,258,6,en,en
true,importance early insulin secretion,objective study compare effect nateglinide glyburide placebo postmeal glucose excursion insulin secretion previously diet treated patient type diabetes research design methods randomize double blind placebo controlled multicenter study conduct patient receive either nateglinide mg three meal daily n glyburide mg q titrate mg q week n placebo n week glucose insulin c peptide profile liquid meal challenge measure week week point daytime glucose insulin profile comprise three solid meal measure results liquid meal challenge nateglinide reduce incremental glucose area curve auc effectively glyburide vs mmol h l p lt whereas glyburide reduce fast plasma glucose effectively nateglinide vs mmol l respectively p lt contrast c peptide induce glyburide great induce nateglinide vs nmol h l p lt glyburide increase fast insulin level solid meal challenge nateglinide glyburide elicit similar overall glucose control h incremental auc vs mmol h l insulin auc induce nateglinide significantly less induce glyburide h auc vs pmol h l p conclusions study demonstrate nateglinide selectively enhance early insulin release provide good mealtime glucose control less total insulin exposure glyburide,Hollander PA,2001,Diabetes Care,https://doi.org/10.2337/diacare.24.6.983,11375357,Hollander PA; Schwartz SL; Gatlin MR; Haas SJ; Zheng H; Foley JE; Dunning BE,article,"D016430: Clinical Trial; D003160: Comparative Study; D016428: Journal Article; D016448: Multicenter Study; D016449: Randomized Controlled Trial; D013485: Research Support, Non-U.S. Gov't","D000368: Aged; D019540: Area Under Curve; D001786: Blood Glucose; D002096: C-Peptide; D003510: Cyclohexanes; D003924: Diabetes Mellitus, Type 2; D003927: Diet, Diabetic; D004311: Double-Blind Method; D005215: Fasting; D005260: Female; D005905: Glyburide; D006442: Glycated Hemoglobin; D006801: Humans; D007004: Hypoglycemic Agents; D007328: Insulin; D000078790: Insulin Secretion; D008297: Male; D008875: Middle Aged; D000077715: Nateglinide; D010649: Phenylalanine; D010919: Placebos; D019518: Postprandial Period; D011384: Proinsulin; D016037: Single-Blind Method; D013997: Time Factors",,,https://openalex.org/W1994361841,37,5,1,1735,327,10,en,en
false,effect inorganic chromium brewer yeast supplementation glucose tolerance serum lipid drug dosage individual type diabetes,study effect supplementation organic inorganic chromium glucose tolerance serum lipid drug dosage type diabetes patient hope find good economical method control seventy eight type diabetes patient divide randomly two group give brewer yeast ug cr day crcl ug cr day sequentially placebo double blind cross design four stage last week beginning end stage subject weigh dietary data drug dosage record blood urine sample collect analysis glucose fast hour post g glucose load fructosamine triglyceride total hdl cholesterol serum urinary chromium supplement cause significant decrease mean glucose fast hour post glucose load fructosamine triglyceride mean hdl cholesterol serum urinary chromium increase mean drug dosage decrease slightly significantly case glibenclamide supplement patient longer required insulin change note dietary intake body mass index high percentage subject respond positively brewer yeast chromium retain body effect fructosamine triglyceride hdl cholesterol maintain subject placebo follow mean urinary chromium remain significantly high zero time mean chromium supplementation give good control glucose lipid variable decrease drug dosage type diabetes patient large scale study need help decide convenient chemical form dosage require achieve optimal response,Bahijiri SM,2000,Saudi Med J,,11376359,Bahijiri SM; Mira SA; Mufti AM; Ajabnoor MA,article,D016430: Clinical Trial; D003160: Comparative Study; D016428: Journal Article; D016449: Randomized Controlled Trial,"D000328: Adult; D000368: Aged; D002712: Chlorides; D017608: Chromium Compounds; D018592: Cross-Over Studies; D003924: Diabetes Mellitus, Type 2; D004305: Dose-Response Relationship, Drug; D004311: Double-Blind Method; D004359: Drug Therapy, Combination; D005260: Female; D005951: Glucose Tolerance Test; D006801: Humans; D007004: Hypoglycemic Agents; D008055: Lipids; D008297: Male; D008875: Middle Aged; D012441: Saccharomyces cerevisiae; D016896: Treatment Outcome",,,https://openalex.org/W1739919717,156,26,1,1801,310,7,en,en
true,match treatment pathophysiology type diabetes,type diabetes progressive condition patient whose disease initially control diet exercise eventually need single multiple pharmacologic agent maintain adequate glycemic control although current treatment standard require combination therapy institute failure monotherapy result diabetes control complication trial united kingdom prospective diabetes study suggest aggressive initial treatment crucial slow evolution long term complication associate disease article review diagnosis classification type diabetes describe multiple defect glucose metabolism associate disease discuss various pharmacologic option achieve glycemic control patients information review compile search medline search term include limit type diabetes antihyperglycemic agent addition abstract identify use web site diabetes related professional organizations two pathophysiologic mechanism insulin resistance impaired insulin secretion usually present diagnosis type diabetes several study show combination therapy antihyperglycemic agent different mechanism action provide great efficacy treatment single agents current research suggest early aggressive treatment combination therapy achieve glycemic control low dos side effect monotherapy either component,Gerich JE,2001,Clin Ther,https://doi.org/10.1016/s0149-2918(01)80017-5,11394726,Gerich JE,article,"D016428: Journal Article; D013485: Research Support, Non-U.S. Gov't; D016454: Review","D003924: Diabetes Mellitus, Type 2; D004359: Drug Therapy, Combination; D018149: Glucose Intolerance; D006801: Humans; D007004: Hypoglycemic Agents; D007328: Insulin; D007333: Insulin Resistance; D000078790: Insulin Secretion",,,https://openalex.org/W2046224702,56,8,1,1633,235,5,en,en
false,effect month ingestion ginkgo biloba extract egb pancreatic cell function response glucose load individual non insulin dependent diabetes mellitus,first report journal clinical pharmacology show ingestion mg ginkgo biloba extract egb daily month normal glucose tolerant individual cause significant increase pancreatic beta cell insulin c peptide response measure area curve auc hour standard g oral glucose tolerance test ogtt follow study design determine effect ginkgo biloba treatment glucose stimulated pancreatic beta cell function non insulin dependent diabetes mellitus niddm subject diet controlled subject fast plasma glucose fpg mg dl fast plasma insulin fpi microu ml n ingestion ginkgo biloba produce significant effect insulin auc vs microu ml h ingest ginkgo biloba respectively hyperinsulinemic niddm subject take oral hypoglycemic medication n fpg mg dl fpi microu ml ingestion ginkgo biloba cause blunted plasma insulin level minute ogtt lead reduction insulin auc vs microu ml h ginkgo biloba respectively c peptide level increase auc parallel insulin auc create dissimilar insulin c peptide ratio indicative enhanced hepatic extraction insulin relative c peptide thus pancreatic beta cells already maximally stimulate ingestion ginkgo biloba may cause reduction plasma insulin level niddm subject pancreatic exhaustion fpg mg dl fpi microu ml n also take oral hypoglycemic agent ginkgo biloba ingestion significantly increase pancreatic beta cell function response glucose loading insulin auc increase microu ml h p parallel c peptide auc increase p whether increase due resuscitation previously exhaust islet increased activity remain functional islet unclear however even group increase pancreatic beta cell activity cause reduction blood glucose ogtt conclude ingestion ginkgo biloba extract niddm subject may increase hepatic metabolic clearance rate insulin also hypoglycemic agent result reduce insulin mediated glucose metabolism elevate blood glucose,Kudolo GB,2001,J Clin Pharmacol,https://doi.org/10.1177/00912700122010483,11402628,Kudolo GB,article,"D016430: Clinical Trial; D016428: Journal Article; D013485: Research Support, Non-U.S. Gov't","D001786: Blood Glucose; D002096: C-Peptide; D003924: Diabetes Mellitus, Type 2; D004032: Diet; D005260: Female; D020441: Ginkgo biloba; D005951: Glucose Tolerance Test; D006801: Humans; D007004: Hypoglycemic Agents; D007328: Insulin; D007515: Islets of Langerhans; D008297: Male; D008875: Middle Aged; D008517: Phytotherapy; D010936: Plant Extracts; D014665: Vasodilator Agents",,,https://openalex.org/W2045016419,194,34,1,2645,494,11,en,en
false,lesson glitazones story drug development,troglitazone first thiazolidinedione class oral hypoglycaemic agent launch usa march reach europe later year withdraw within week ground liver toxicity meanwhile go generate sale billion usa cause least case liver failure result death transplantation withdraw march rosiglitazone pioglitazone reach u market first line agent use alone combination drug europe dossier use one year later apply limited licence second line agent restrict oral combination therapy use glitazones achieve blockbuster status without clear evidence advantage exist therapy,Gale EA,2001,Lancet,https://doi.org/10.1016/s0140-6736(00)04960-6,11410214,Gale EA,article,"D003160: Comparative Study; D016428: Journal Article; D013485: Research Support, Non-U.S. Gov't; D016454: Review","D016907: Adverse Drug Reaction Reporting Systems; D056486: Chemical and Drug Induced Liver Injury; D002839: Chromans; D003924: Diabetes Mellitus, Type 2; D017277: Drug Approval; D004359: Drug Therapy, Combination; D005060: Europe; D006801: Humans; D007004: Hypoglycemic Agents; D017093: Liver Failure; D000077205: Pioglitazone; D000077154: Rosiglitazone; D013844: Thiazoles; D045162: Thiazolidinediones; D000077288: Troglitazone; D014481: United States",,,https://openalex.org/W2124084557,56,10,1,852,158,6,en,en
