include,title,abstract,first_author,year,journal,doi,pubmed_id,authors,pubmed_type,publication_types,mesh,webofscience_id,central_id,openalex_id,title_length,title_word_count,title_sentence_count,abstract_length,abstract_word_count,abstract_sentence_count,language_title,language_abstract
false,comparison bedtime insulin regimen patient type diabetes mellitus,background compare insulin regimen combination therapy oral hypoglycemic agent bedtime insulin produce similar improvement glycemic control induces less weight gain objective determine whether bedtime insulin regimen differ respect effect weight gain patient type diabetes design randomize control trial setting four outpatient clinic central hospital patient patient mean age year mean body mass index kg whose type diabetes poorly control sulfonylurea therapy mean glycosylated hemoglobin value mean fast plasma glucose level mmol l mg dl intervention random assignment year treatment bedtime intermediate acting insulin plus glyburide mg placebo metformin g placebo glyburide metformin second injection intermediate acting insulin morning patient teach adjust bedtime insulin dose basis fast glucose measurement measurement body weight biochemical symptomatic hypoglycemia index glycemic control result year body weight remain unchanged patient receive bedtime insulin plus metformin mean change kg p compare group increase kg kg kg patient receive bedtime insulin plus glyburide receive bedtime insulin plus oral drug receive bedtime morning insulin respectively great decrease glycosylated hemoglobin value observe bedtime insulin metformin group difference percentage point year p compare month p compare group group also significantly symptomatic biochemical case hypoglycemia p group conclusion combination therapy bedtime insulin plus metformin prevents weight gain regimen also seem superior bedtime insulin regimens respect improvement glycemic control frequency hypoglycemia,Yki-Järvinen H,1999,Ann Intern Med,https://doi.org/10.7326/0003-4819-130-5-199903020-00002,10068412,Yki-Järvinen H; Ryysy L; Nikkilä K; Tulokas T; Vanamo R; Heikkilä M,article,"D016430: Clinical Trial; D003160: Comparative Study; D016428: Journal Article; D016449: Randomized Controlled Trial; D013485: Research Support, Non-U.S. Gov't","D000419: Albuminuria; D001786: Blood Glucose; D001794: Blood Pressure; D002096: C-Peptide; D003924: Diabetes Mellitus, Type 2; D004334: Drug Administration Schedule; D004359: Drug Therapy, Combination; D005500: Follow-Up Studies; D005905: Glyburide; D006442: Glycated Hemoglobin; D006801: Humans; D007004: Hypoglycemic Agents; D007328: Insulin; D008055: Lipids; D008687: Metformin; D008875: Middle Aged; D015430: Weight Gain",,,https://openalex.org/W1981978041,80,12,1,2215,407,13,en,en
true,effect katpchannel blockade glibenclamide warm phenomenon,increase tolerance myocardial ischaemia observe second two sequential exercise test e warm phenomenon propose clinical model ischaemic preconditioning atp sensitive k channel appear mediator ischaemic preconditioning experimental clinical study aim study investigate role k atp channel warm phenomenon twenty six patient coronary artery disease randomize receive mg oral glibenclamide selective atp sensitive k channel blocker placebo sixty minute glibenclamide placebo administration patient give infusion dextrose ml x min correct glucose plasma level respectively infusion saline infusion rate thirty minute beginning infusion patient group underwent two consecutive treadmill exercise test recovery period min establish baseline condition exercise test blood glucose level similar placebo glibenclamide group vs mg x ml p ns placebo administration rate pressure product mm st segment depression significantly increase second exercise test compare first vs beat x min x mmhg x p change glibenclamide vs beat x min x mmhg x p ns significant drug test interaction p two way anova glibenclamide dose previously show abolish ischaemic preconditioning coronary angioplasty prevent increase ischaemic threshold observe second two sequential exercise test finding confirm ischaemic preconditioning play key role warm phenomenon setting least partially mediate activation atp sensitive k channel,Tomai F,1999,Eur Heart J,https://doi.org/10.1053/euhj.1998.1311,10082152,Tomai F; Danesi A; Ghini AS; Crea F; Perino M; Gaspardone A; Ruggeri G; Chiariello L; Gioffrè PA,article,D016430: Clinical Trial; D003160: Comparative Study; D016428: Journal Article; D016449: Randomized Controlled Trial,"D000255: Adenosine Triphosphate; D000284: Administration, Oral; D000328: Adult; D000368: Aged; D003327: Coronary Disease; D004562: Electrocardiography; D005080: Exercise Test; D005260: Female; D005500: Follow-Up Studies; D005905: Glyburide; D006801: Humans; D007004: Hypoglycemic Agents; D019157: Ischemic Preconditioning, Myocardial; D008297: Male; D008875: Middle Aged; D026902: Potassium Channel Blockers; D016037: Single-Blind Method; D016896: Treatment Outcome",,,https://openalex.org/W1990802756,74,10,1,1967,362,8,en,en
false,short term intensive insulin therapy method overcome secondary failure sulfonylurea patient type diabetes non insulin dependent,study group comprise patient male female type diabetes secondary failure sulphonylurea derivates su develop patient submit day therapy injection insulin per day total dose insulin permit decrease mean daily glycaemia mmol l mg dl termination intensive insulin therapy iit patient insulin requirement u daily alternatively qualify treatment su glybenclamide alone su plus biguanide derivate bg phenformin need u daily continue conventional therapy insulin alone insulin plus su glybenclamide marked reduction fasting postprandial blood glucose iit subsequent month follow mean glycaemia initially fast state mmol l mg dl hour breakfast mmol l mg dl decrease significantly four group mmol l mg dl mmol l mg dl fast state mg dl mmol l mg dl breakfast least hypoglycaemic effect find patient iit treat exclusively insulin mean daily dose iu decrease glycaemia evident patient treat su give single drug combination bg insulin mean daily dose iu studied patient basal stimulate mg glucagon v c peptide secretion markedly decrease iit greatly increase termination increase persist follow month observation correlate initial values short term iit patient niddm secondary failure su effective reduce hyperglycaemia make possible continue oral antidiabetic treatment su secretion endogenous insulin seem limited influence metabolic control patient treat four different pharmacological regiment iit,Jedynasty K,1998,Pol Arch Med Wewn,,10085698,Jedynasty K; Kasperska-Czyzykowa T; Stepień K; Nowaczyk R,article,D016430: Clinical Trial; D004740: English Abstract; D016428: Journal Article,"D000368: Aged; D003924: Diabetes Mellitus, Type 2; D004334: Drug Administration Schedule; D004351: Drug Resistance; D004359: Drug Therapy, Combination; D005260: Female; D005905: Glyburide; D006801: Humans; D007004: Hypoglycemic Agents; D007328: Insulin; D008297: Male; D008875: Middle Aged; D010629: Phenformin; D013453: Sulfonylurea Compounds; D017211: Treatment Failure",,,https://openalex.org/W2467368005,157,25,1,2237,415,9,en,en
true,year multicenter randomize double blind comparison repaglinide glyburide treatment type diabetes dutch german repaglinide study group,objective repaglinide newly develop oral blood glucose lowering agent exert effect stimulate insulin secretion multicenter study design compare efficacy safety drug glyburide year randomized double blind study outpatient type diabetes research design method total subject woman men participate following characteristic age year duration diabetes year range bmi kg hba c fast plasma glucose mmol l majority subject previously treat sulfonylurea alone combination metformin patient randomize ratio repaglinide mg glyburide mg daily treatment study protocol include screen visit assess patient eligibility titration period week dosage repaglinide glyburide optimize subsequent month treatment period fixed optimal dosage result trial complete subject repaglinide glyburide group hba c initially decrease group increase second half year maintenance period similar extent repaglinide glyburide subject vs screening respectively small group subject previously control condition diet n sustained improvement metabolic control could observe drug slightly good glyburide repaglinide theta hba c vs p lt trend see fast plasma glucose change serum lipid course study repaglinide treated glyburide treated subject withdraw due adverse event mostly hyperglycemia difference adverse event drug report difference incidence hypoglycemia conclusion repaglinide safe efficacious oral blood glucose lowering agent potency similar glyburide rapid onset action hepatic clearance allow meal related administration include subject impaired kidney function,Wolffenbuttel BH,1999,Diabetes Care,https://doi.org/10.2337/diacare.22.3.463,10097930,Wolffenbuttel BH; Landgraf R,article,D016430: Clinical Trial; D003160: Comparative Study; D016428: Journal Article; D016448: Multicenter Study; D016449: Randomized Controlled Trial,"D000328: Adult; D001786: Blood Glucose; D002219: Carbamates; D003924: Diabetes Mellitus, Type 2; D004311: Double-Blind Method; D005215: Fasting; D005260: Female; D005905: Glyburide; D006442: Glycated Hemoglobin; D006801: Humans; D007004: Hypoglycemic Agents; D008297: Male; D008875: Middle Aged; D010880: Piperidines",,,https://openalex.org/W2127119840,164,25,2,2359,438,18,en,en
false,short term cost effectiveness model oral antidiabetic medicine europe,short term month cost effectiveness model develop simulate current medical practice disease progression patient type non insulin dependent diabetes mellitus uncontrolled diet exercise model base decision analytical technique include probability switch treatment reason switch common switch option effectiveness economic measure main outcome order assess effectiveness use symptom free day acceptable control sfdacs represent day treatment without adverse event symptom acceptable control glucose lipid economic evaluation incremental cost incur directly health insurance system consider model prove useful evaluation new oral antidiabetic agent since short term aim antidiabetic therapy provide adequate control absence adverse effect symptom prerequisite successful long term treatment furthermore short term analysis provide data compare initial investment drug therapy potential saving longer treatment period,Hood SC,1998,Pharmacoeconomics,10.2165/00019053-199813030-00006,10178657,Hood SC; Annemans L; Rutten-van Mölken M,article,"D003160: Comparative Study; D016428: Journal Article; D013485: Research Support, Non-U.S. Gov't","D003362: Cost-Benefit Analysis; D003924: Diabetes Mellitus, Type 2; D005060: Europe; D005905: Glyburide; D006801: Humans; D007004: Hypoglycemic Agents; D007328: Insulin; D008687: Metformin; D018803: Models, Economic",,,,80,12,1,1210,196,7,en,en
false,evaluation potential clinical economic effect bodyweight stabilisation acarbose patient type diabetes mellitus,bodyweight acknowledged independent risk factor coronary heart disease chd present model analysis undertake investigate clinical economic impact bodyweight gain patient type non insulin dependent diabetes mellitus effect development chd base retrospective evaluation data diabetes intervention study dis patient type diabetes mellitus stable bodyweight group significantly low rate combine chd event patient show bodyweight gain group b year prevention bodyweight gain therefore appear meaningful strategy management diabetes mellitus addition clinical advantage prevention chd also result economic saving associate avoided treatment coronary event base clinical outcome dis calculated per patient net saving patient type diabetes mellitus stable bodyweight amount deutschmark dm compare patient experience bodyweight increase step situation project current type diabetes mellitus practice oral first line treatment type diabetes mellitus usually initiate glibenclamide glyburide know increase bodyweight reflect group b novel alpha glucosidase inhibitor acarbose contrast appear effective glibenclamide advantage bodyweight neutral reflect group clinical viewpoint acarbose thus consider alternative glibenclamide viewpoint drug cost monotherapy acarbose time expensive glibenclamide germany result per patient incremental cost dm acarbose year balance potential year cost saving dm result potential acarbose prevent chd around one third incremental cost acarbose may recoup single effect however far possible benefit acarbose include avoidance hypoglycaemia deferral costly insulin therapy may improve economic value novel antidiabetic agent give indirect approach evaluation many limitation finding need critical appraisal comparative trial urgently require substantiate preliminary result,Banz K,1998,Pharmacoeconomics,https://doi.org/10.2165/00019053-199813040-00007,10178668,Banz K; Dinkel R; Hanefeld M; Schwanebeck U,article,"D016428: Journal Article; D013485: Research Support, Non-U.S. Gov't","D020909: Acarbose; D000328: Adult; D001835: Body Weight; D003661: Decision Support Techniques; D003924: Diabetes Mellitus, Type 2; D005260: Female; D006801: Humans; D008297: Male; D008875: Middle Aged; D014312: Trisaccharides",,,https://openalex.org/W2040971139,141,20,1,2461,418,14,en,en
false,troglitazone,unlabelled troglitazone first new group oral antidiabetic drug thiazolidinediones indicate treatment patient type non insulin dependent diabetes mellitus troglitazone act enhance effect insulin peripheral target site unlike sulphonylurea drug associate hypoglycaemia administer monotherapy clinical trial troglitazone usually mg day patient type diabetes mellitus consistently show marked improvement glycaemic control well reduction fast serum insulin c peptide triglyceride level comparative study either glibenclamide glyburide metformin indicated similar glycaemic control troglitazone agent serum insulin level low troglitazone glibenclamide clinical trial approximately year duration show glycaemic control maintain troglitazone long term basis general troglitazone well tolerate majority patient however discontinuation troglitazone elevated liver enzyme level occur approximately patient receive drug frequent monitoring liver enzyme require e g least time first year therapy among patient start troglitazone therapy incorporation boxed warning increase monitoring requirement product labelling estimate risk liver related death approximately conclusion troglitazone improve ability target cell respond insulin drug show improve glycaemic control patient type diabetes mellitus use monotherapy combination oral antidiabetic drug insulin efficacy similar glibenclamide metformin although troglitazone generally well tolerate close monitoring liver enzyme function require minimise rare occurrence serious hepatic dysfunction drug acquisition liver function monitoring cost well potential adverse effect important factor may ultimately determine precise place troglitazone management type diabetes mellitus nevertheless first member new class oral antidiabetic agent thiazolidinediones troglitazone offer effective treatment option patient type diabetes mellitus action improve insulin sensitivity,Plosker GL,1999,Drugs,https://doi.org/10.2165/00003495-199957030-00014,10193691,Plosker GL; Faulds D,article,D016428: Journal Article; D016454: Review,"D000328: Adult; D000368: Aged; D000818: Animals; D019540: Area Under Curve; D002839: Chromans; D003924: Diabetes Mellitus, Type 2; D004347: Drug Interactions; D005947: Glucose; D005905: Glyburide; D006207: Half-Life; D006801: Humans; D007004: Hypoglycemic Agents; D016032: Randomized Controlled Trials as Topic; D013844: Thiazoles; D045162: Thiazolidinediones; D000077288: Troglitazone",,,https://openalex.org/W2051006205,12,1,1,2543,412,15,en,en
true,relationship fast plasma glucose glycosylated hemoglobin,contextnew criterion diagnosis type diabetes mellitus recently introduce lower diagnostic fasting plasma glucose fpg concentration mmol l mg dl objectiveto determine individual diabetes diagnose new fpg concentration criterion would excessive glycosylation elevate hemoglobin hba c level definitionswe determine distribution hba c level individual use classification normal new criterion fpg concentration mmol l mg dl impair fast glucose new criterion fpg concentration mmol l mg dl diabetes diagnose solely new fpg concentration criterion mmol l mg dl diabetes diagnose previous fpg concentration criterion mmol l mg dl higher designcross sectional analysis large data set nhanes iii meta analysis research group mrg diagnosis diabetes use glycated hemoglobin contain individual fpg concentration hour glucose concentration use oral glucose tolerance test hba c level simultaneously measure cross tabulated fpg concentration mmol l mg dl mmol l mg dl mmol l mg dl mmol l mg dl hba c level separate interval normal less upper limit normal uln slightly elevate uln uln plus high high uln plus resultsamong subject normal fpg concentration hba clevels nhanes iii mrg data set normal slightly elevate high among individual impaired fast glucose hba c concentration normal slightly elevate high among diabetic patient diagnose new fpg criterion hba c level normal slightly elevate high diabetic patient diagnose former fpg criterion hba c level normal slightly elevate high conclusionsabout new cohort diabetic patient data set normal hba c level believe diabetes diagnose fpg concentration less mmol l mg dl unless excessive glycosylation evident individual without excessive glycosylation moderate elevation fpg concentration mmol l mg dl diagnose impaired fast glucose treat appropriate diet exercise diagnostic labeling achieve goal early intervention without subject person potentially negative insurance employment social psychological consequence diagnosis diabetes mellitus,Davidson MB,1999,JAMA,https://doi.org/10.1001/jama.281.13.1203,10199430,Davidson MB; Schriger DL; Peters AL; Lorber B,article,D016428: Journal Article,"D000328: Adult; D001786: Blood Glucose; D003430: Cross-Sectional Studies; D003924: Diabetes Mellitus, Type 2; D005189: False Positive Reactions; D005215: Fasting; D005951: Glucose Tolerance Test; D006442: Glycated Hemoglobin; D006801: Humans",,,https://openalex.org/W2113628803,71,8,1,2955,576,8,en,en
false,sulfonylurea ischaemic preconditioning double blind placebo controlled evaluation glimepiride glibenclamide,glimepiride new sulfonylurea diabetes treatment suppose impact less extra pancreatic atp dependent k channel conventional drug glibenclamide study perform evaluate whether result good maintenance atp dependent k channel mediate ischaemic myocardial preconditioning double blind placebo controlled study period total coronary occlusion balloon angioplasty high grade coronary artery stenosis use model compare effect drug quantification myocardial ischaemia achieve record intracoronary ecg time occurrence angina vessel occlusion patient underwent three dilatation first dilatation dilatation serve determine severity ischaemia vessel occlusion dilatation baseline value record thereafter glimepiride patient mg glibenclamide patient mg placebo patient intravenously administer min dilatation start min beginning drug administration mean st segment shift placebo group decrease dilatation dilatation mv ci mv p similar reduction also occur glimepiride group repetitive balloon occlusion lead reduction dilatation dilatation mv ci mv p little influence however mean st segment shift glibenclamide group dilatation dilatation mv ci mv p accordingly time angina balloon occlusion slightly increase placebo group dilatation dilatation ci p increase glimepiride group dilatation dilatation ci p remain unchanged glibenclamide group dilatation dilatation ci p result show glimepiride maintain myocardial preconditioning glibenclamide might able prevent,Klepzig H,1999,Eur Heart J,https://doi.org/10.1053/euhj.1998.1242,10213347,Klepzig H; Kober G; Matter C; Luus H; Schneider H; Boedeker KH; Kiowski W; Amann FW; Gruber D; Harris S; Burger W,article,"D016430: Clinical Trial; D003160: Comparative Study; D016428: Journal Article; D016448: Multicenter Study; D016449: Randomized Controlled Trial; D013485: Research Support, Non-U.S. Gov't","D000328: Adult; D000368: Aged; D015906: Angioplasty, Balloon, Coronary; D003327: Coronary Disease; D004311: Double-Blind Method; D004562: Electrocardiography; D005260: Female; D005905: Glyburide; D006801: Humans; D007004: Hypoglycemic Agents; D007275: Injections, Intravenous; D019194: Ischemic Preconditioning; D008297: Male; D008875: Middle Aged; D013453: Sulfonylurea Compounds; D016896: Treatment Outcome",,,https://openalex.org/W2162891101,123,14,1,2133,400,12,en,en
false,effect gliclazide plasma insulin intact split proinsulin south asian subject type diabetes mellitus,diabetic medicinevolume issue p effect gliclazide plasma insulin intact split proinsulin south asian subject type diabetes mellitus first publish december http doi org j xcitations aboutpdf toolsrequest permissionexport citationadd favoritestrack citation shareshare give accessshare full text accessshare full text accessplease review term condition use check box share full text version article read accept wiley online library term condition useshareable linkuse link share full text version article friend colleague learn copy url share linkshare onfacebooktwitterlinked inredditwechat cite literature volume issue february pages relatedinformation,Ammari F,1999,Diabet Med,https://doi.org/10.1046/j.1464-5491.1999.00025.x,10229308,Ammari F; Davies MJ; Koppiker N; Gregory R; Burden AC,article,"D016430: Clinical Trial; D018848: Controlled Clinical Trial; D016428: Journal Article; D013485: Research Support, Non-U.S. Gov't","D000328: Adult; D000368: Aged; D001210: Asia, Southeastern; D003924: Diabetes Mellitus, Type 2; D005260: Female; D005907: Gliclazide; D006801: Humans; D007004: Hypoglycemic Agents; D007328: Insulin; D000078790: Insulin Secretion; D007515: Islets of Langerhans; D008297: Male; D008875: Middle Aged; D011384: Proinsulin; D011498: Protein Precursors; D006113: United Kingdom",,,https://openalex.org/W2467311283,131,22,1,864,119,2,en,en
true,double blind randomized comparison meal related glycemic control repaglinide glyburide well controlled type diabetic patient,objective study design compare diurnal blood glucose excursion effect accidental dietary noncompliance type diabetic patient well controlled either repaglinide glyburide treatment research design method single center double blind randomize study comprise type diabetic patient whose mean fast blood glucose value repaglinide glyburide titration stabilization range mg dl study consist initial screening day titration period week week stabilization period study period end study day day study period half patient group receive two meal first day three meal next day half sequence reverse repaglinide administer preprandially meal glyburide administer recommend current labeling e either one two daily dos breakfast dinner regardless whether lunch omit diurnal blood glucose excursion day three meal eat compare two group minimum blood glucose concentration bgmin measurement compare lunch dinner day three two meal result randomized patient enter day study period complete trial result show significant difference repaglinide glyburide group average blood glucose excursion fast blood glucose p influence mean bgmin omit meal differ significantly repaglinide glyburide group p latter group bgmin decrease mg dl result omit lunch whereas repaglinide group bgmin unchanged two meal day mg dl three meal day mg dl hypoglycemic event n occur glyburide group two meal day connection omit lunch hypoglycemic event record repaglinide group conclusion result suggest treatment repaglinide well controlled type diabetic patient miss delay meal superior treatment longer acting sulfonylurea drug glyburide respect risk hypoglycemic episode,Damsbo P,1999,Diabetes Care,https://doi.org/10.2337/diacare.22.5.789,10332683,Damsbo P; Clauson P; Marbury TC; Windfeld K,article,D016430: Clinical Trial; D003160: Comparative Study; D016428: Journal Article; D016449: Randomized Controlled Trial,"D000328: Adult; D000368: Aged; D001786: Blood Glucose; D002219: Carbamates; D003924: Diabetes Mellitus, Type 2; D003927: Diet, Diabetic; D004311: Double-Blind Method; D004334: Drug Administration Schedule; D004435: Eating; D002149: Energy Intake; D005215: Fasting; D005905: Glyburide; D006801: Humans; D007004: Hypoglycemic Agents; D008875: Middle Aged; D010880: Piperidines",,,https://openalex.org/W1988474859,143,19,1,2363,414,13,en,en
